{
  "schema_version": "repo03.automotive-power.scenario.v1",
  "scenario_id": "POWER-COLD-CRANK-001",
  "engine_id": "repo03-power-engine",
  "module_id": "automotive_power",
  "variant_id": "B",
  "enabled_modules": [
    "automotive_power",
    "shutdown"
  ],
  "variant_contract": {
    "schema_version": "repo03.variant.schema.v1",
    "profile_hash": "1b82f114d7fb4280f55d3f72a7a61816f38242b7495a23cfa468f17b92d00fcd",
    "source": {
      "classification": "ENGINEERING_RULE",
      "authority": "ENGINEERING",
      "reference": "REP-03-D1",
      "version": "1.0.0"
    }
  },
  "source": {
    "classification": "ENGINEERING_RULE",
    "authority": "ENGINEERING",
    "reference": "REP-03-WF-03-05",
    "version": "1.0.0"
  },
  "synthetic_data": true,
  "known_gaps": [
    "GAP-03"
  ],
  "requirements": {
    "input_nominal_voltage": {
      "value": 12,
      "unit": "V",
      "source": {
        "classification": "SOURCE_EXPLICIT",
        "authority": "PROJECT_REQUIREMENT",
        "reference": "REP-03-WF-03-05-REQUIREMENTS",
        "version": "1.0.0"
      }
    },
    "output_target_voltage": {
      "value": 5.1,
      "unit": "V",
      "source": {
        "classification": "SOURCE_EXPLICIT",
        "authority": "PROJECT_REQUIREMENT",
        "reference": "REP-03-WF-03-05-REQUIREMENTS",
        "version": "1.0.0"
      }
    },
    "output_target_current": {
      "value": 5,
      "unit": "A",
      "source": {
        "classification": "SOURCE_EXPLICIT",
        "authority": "PROJECT_REQUIREMENT",
        "reference": "REP-03-WF-03-05-REQUIREMENTS",
        "version": "1.0.0"
      }
    }
  },
  "rep02_adapter": {
    "schema_version": "repo03.rep02.file-adapter.v1",
    "transport": "FILE_API",
    "native_api": "JSON_COMPATIBLE_MAPPING",
    "source": {
      "classification": "SOURCE_EXPLICIT",
      "authority": "ENGINEERING",
      "reference": "power-rail-validation-and-review",
      "version": "79ae5ba1a842cf2cc206eed408d71214ff2c43bc"
    },
    "profile_hash": "709a8a0e086e099bd9ca7f1aaf09ea20fca44e34a71a74dabcc354a6278dbcec",
    "rail_budget": {
      "input_schema_version": "1.0.0",
      "package_version": "0.3.0",
      "formula_version": "REP02-RB-1.0.0",
      "rule_id": "REP02.RAIL_BUDGET.STATIC",
      "input_fields": [
        "schema_version",
        "rail",
        "loads",
        "capacity",
        "derating",
        "efficiency",
        "sources"
      ],
      "units": {
        "voltage": "V",
        "current": "A",
        "factor": "1",
        "power": "W"
      }
    },
    "sequencing": {
      "input_schema_version": "1.0.0",
      "engine_version": "0.3.0",
      "fsm_version": "REP02-SEQ-FSM-1.0.0",
      "rule_set_version": "REP02-SEQ-RULESET-1.0.0",
      "input_fields": [
        "schema_version",
        "scenario_id",
        "scenario_kind",
        "timing_rules",
        "power_off_rule",
        "events",
        "sources",
        "observation_end_offset",
        "observation_end_at",
        "observation_provenance",
        "observation_source_refs",
        "sorting_policy",
        "simultaneous_policy"
      ],
      "units": {
        "time": "s"
      }
    }
  },
  "profile": {
    "profile_type": "cold_crank",
    "input_voltage": 6,
    "duration_ms": 100,
    "suppression_state": "NOT_APPLICABLE",
    "source": {
      "classification": "ASSUMPTION",
      "authority": "ENGINEERING",
      "reference": "REP-03-WF-03-05-SYNTHETIC-PROFILES",
      "version": "1.0.0"
    }
  },
  "assessment_scope": "SYNTHETIC_REQUIREMENT_ONLY"
}
